{
  "schema_version": "1.1",
  "id": "CR-0003-1.decision",
  "composition_revision_id": "CR-0003-1",
  "stages": [
    {
      "stage": "intent",
      "candidates": [
        {
          "ref": "coding"
        },
        {
          "ref": "general"
        }
      ],
      "filters": [],
      "chosen": [
        "general"
      ],
      "why": "no coding, review or research signal; the classifier's fallback",
      "override": null
    },
    {
      "stage": "harness_model",
      "candidates": [
        {
          "ref": "claude-code/example-model"
        }
      ],
      "filters": [],
      "chosen": [
        "claude-code/example-model"
      ],
      "why": "routing decision",
      "override": null
    },
    {
      "stage": "assets",
      "candidates": [
        {
          "ref": "claude-skills:example-deploy",
          "digest": "sha256:eeeeeeeeeeeeeeeeeeeeeeeeeeeeeeeeeeeeeeeeeeeeeeeeeeeeeeeeeeeeeeee",
          "evidence": [
            "tag deploy does not match intent coding"
          ]
        }
      ],
      "filters": [
        {
          "filter": "compatibility",
          "removed": [
            "claude-skills:example-deploy"
          ],
          "reason": "requires a command the worktree does not provide"
        }
      ],
      "chosen": [],
      "why": "no optional asset fits this task; attaching none is the least-privilege composition",
      "override": null
    },
    {
      "stage": "context",
      "candidates": [
        {
          "ref": "typescript-style"
        }
      ],
      "filters": [],
      "chosen": [
        "typescript-style"
      ],
      "why": "repository language",
      "override": null
    },
    {
      "stage": "policy",
      "candidates": [
        {
          "ref": "read-only"
        }
      ],
      "filters": [],
      "chosen": [
        "read-only"
      ],
      "why": "workspace approval mode is read-only",
      "override": null
    },
    {
      "stage": "confirm",
      "candidates": [
        {
          "ref": "operator"
        }
      ],
      "filters": [],
      "chosen": [
        "operator"
      ],
      "why": "confirmed before start",
      "override": null
    }
  ]
}
